{
  "$schema": "http://json-schema.org/draft-07/schema#",
  "title": "Catalyst handoff brief",
  "type": "object",
  "additionalProperties": false,
  "required": ["schema_version", "key", "timestamp", "mode", "resume", "state"],
  "properties": {
    "schema_version": {"const": "1"},
    "key": {"type": "string", "minLength": 1},
    "timestamp": {"type": "string", "pattern": "^\\d{4}-\\d{2}-\\d{2}T\\d{2}:\\d{2}:\\d{2}Z$"},
    "mode": {"enum": ["WRITE", "RECOVER"]},
    "resume": {
      "type": "object", "additionalProperties": false,
      "required": ["done_when", "resume_by"],
      "properties": {
        "done_when": {"type": "string", "minLength": 1},
        "resume_by": {"type": "string", "minLength": 1},
        "prompt": {"type": "string"},
        "history_pointer": {"type": "string"}
      }
    },
    "state": {
      "type": "object", "additionalProperties": false,
      "required": ["branch", "next_acceptance_check", "worktree"],
      "properties": {
        "branch": {"type": "string", "minLength": 1},
        "next_acceptance_check": {"type": "string", "minLength": 1},
        "worktree": {
          "type": "object", "additionalProperties": false,
          "required": ["root", "is_linked", "git_common_dir"],
          "properties": {
            "root": {"type": "string", "minLength": 1},
            "is_linked": {"type": "boolean"},
            "git_common_dir": {"type": "string", "minLength": 1}
          }
        },
        "diff_summary": {"type": "string"},
        "tests": {"type": "array", "items": {"type": "object", "additionalProperties": false,
          "required": ["cmd", "result"], "properties": {"cmd": {"type": "string"}, "result": {"enum": ["pass", "fail"]}}}},
        "commands": {"type": "array", "items": {"type": "string"}},
        "decisions": {"type": "array", "items": {"type": "string"}},
        "rejected_paths": {"type": "array", "items": {"type": "string"}},
        "open_risks": {"type": "array", "items": {"type": "string"}},
        "head_sha": {"type": "string", "pattern": "^[0-9a-f]{7,40}$"}
      }
    },
    "files_read_first": {"type": "array", "items": {"type": "object", "additionalProperties": false,
      "required": ["path", "why"], "properties": {"path": {"type": "string"}, "why": {"type": "string"}}}},
    "files_skip": {"type": "array", "items": {"type": "object", "additionalProperties": false,
      "required": ["path", "why"], "properties": {"path": {"type": "string"}, "why": {"type": "string"}}}}
  }
}
