{
  "schema_version": "1",
  "key": "feat-jwt-expiry",
  "timestamp": "2026-05-23T23:14:00Z",
  "mode": "WRITE",
  "resume": {
    "done_when": "src/auth/auth.spec.ts:42-78 all 6 pass.",
    "resume_by": "Extend the JWT expiry check in src/auth/middleware.ts to allow a small clock-skew leeway window.",
    "prompt": "run python3 scripts/handoff-render.py feat-jwt-expiry and continue. next acceptance check: pnpm test src/auth/auth.spec.ts passes 6/6."
  },
  "state": {
    "branch": "feat/jwt-expiry",
    "next_acceptance_check": "pnpm test src/auth/auth.spec.ts passes 6/6.",
    "worktree": {
      "root": "/workspace/project",
      "is_linked": false,
      "git_common_dir": "/workspace/project/.git"
    },
    "diff_summary": "2 files, +18/-6 in src/auth/",
    "tests": [
      {
        "cmd": "pnpm test src/auth/auth.spec.ts",
        "result": "fail"
      }
    ],
    "decisions": [
      "lib is jose (not jsonwebtoken)",
      "comparison is <= (not <)",
      "expiry uses Date.now() UTC ms (not new Date())"
    ],
    "rejected_paths": [
      "< comparison \u2014 off-by-one boundary rejection",
      "new Date() \u2014 allocation in hot path"
    ],
    "open_risks": [
      "Clock skew not yet addressed"
    ]
  },
  "files_read_first": [
    {
      "path": "src/auth/middleware.ts",
      "why": "primary edit target for leeway parameter"
    },
    {
      "path": "src/auth/auth.spec.ts",
      "why": "lines 42-78 are the failing clock-skew tests"
    }
  ],
  "files_skip": [
    {
      "path": ".claude/PROJECT_STATE.md",
      "why": "historical context only; brief has the binding decisions"
    },
    {
      "path": "src/users/*",
      "why": "unrelated to JWT expiry fix"
    }
  ]
}